[
  {
    "id": "cn-math-2022:document",
    "title": "义务教育数学课程标准（2022年版）",
    "authority": "教育部",
    "documentNumber": "教材〔2022〕2号",
    "issuedAt": "2022-03-25",
    "effectiveFrom": "2022年秋季学期",
    "sourceUrl": "https://www.gov.cn/zhengce/zhengceku/2022-04/21/content_5686535.htm",
    "sourceLocator": "附件5；页面注明以2022年5月9日版本为准",
    "status": "authoritative-document"
  },
  {
    "id": "cn-math-2022:primary/number-algebra",
    "title": "小学部分：数与代数",
    "authority": "教育部",
    "documentNumber": "教材〔2022〕2号",
    "issuedAt": "2022-03-25",
    "sourceUrl": "https://www.gov.cn/zhengce/zhengceku/2022-04/21/content_5686535.htm",
    "sourceLocator": "《义务教育数学课程标准（2022年版）》第16-17页，表2",
    "status": "indexed-section"
  },
  {
    "id": "cn-math-2022:primary/geometry",
    "title": "小学部分：图形与几何",
    "authority": "教育部",
    "documentNumber": "教材〔2022〕2号",
    "issuedAt": "2022-03-25",
    "sourceUrl": "https://www.gov.cn/zhengce/zhengceku/2022-04/21/content_5686535.htm",
    "sourceLocator": "《义务教育数学课程标准（2022年版）》第16-17页，表2",
    "status": "indexed-section"
  },
  {
    "id": "cn-math-2022:primary/statistics-probability",
    "title": "小学部分：统计与概率",
    "authority": "教育部",
    "documentNumber": "教材〔2022〕2号",
    "issuedAt": "2022-03-25",
    "sourceUrl": "https://www.gov.cn/zhengce/zhengceku/2022-04/21/content_5686535.htm",
    "sourceLocator": "《义务教育数学课程标准（2022年版）》第16-17页，表2",
    "status": "indexed-section"
  },
  {
    "id": "cn-math-2022:primary/integrated-practice",
    "title": "小学部分：综合与实践",
    "authority": "教育部",
    "documentNumber": "教材〔2022〕2号",
    "issuedAt": "2022-03-25",
    "sourceUrl": "https://www.gov.cn/zhengce/zhengceku/2022-04/21/content_5686535.htm",
    "sourceLocator": "《义务教育数学课程标准（2022年版）》第16-17页，表2",
    "status": "indexed-section"
  },
  {
    "id": "cn-math-2022:primary/number-algebra/stage-1/number-and-operations/content-1",
    "title": "第一学段：万以内数、数位与算盘表数",
    "authority": "教育部",
    "documentNumber": "教材〔2022〕2号",
    "issuedAt": "2022-03-25",
    "sourceUrl": "https://www.gov.cn/zhengce/zhengceku/2022-04/21/content_5686535.htm",
    "sourceLocator": "《义务教育数学课程标准（2022年版）》第18页，第一学段内容要求，数与运算（1）",
    "status": "indexed-section"
  },
  {
    "id": "cn-math-2022:primary/number-algebra/stage-1/number-and-operations/content-2",
    "title": "第一学段：万以内数的比较与相等、不等关系",
    "authority": "教育部",
    "documentNumber": "教材〔2022〕2号",
    "issuedAt": "2022-03-25",
    "sourceUrl": "https://www.gov.cn/zhengce/zhengceku/2022-04/21/content_5686535.htm",
    "sourceLocator": "《义务教育数学课程标准（2022年版）》第18页，第一学段内容要求，数与运算（2）",
    "status": "indexed-section"
  },
  {
    "id": "cn-math-2022:primary/number-algebra/stage-1/number-and-operations/content-3",
    "title": "第一学段：四则运算意义与运算关系",
    "authority": "教育部",
    "documentNumber": "教材〔2022〕2号",
    "issuedAt": "2022-03-25",
    "sourceUrl": "https://www.gov.cn/zhengce/zhengceku/2022-04/21/content_5686535.htm",
    "sourceLocator": "《义务教育数学课程标准（2022年版）》第18页，第一学段内容要求，数与运算（3）",
    "status": "indexed-section"
  },
  {
    "id": "cn-math-2022:primary/number-algebra/stage-1/number-and-operations/content-4",
    "title": "第一学段：整数加减法的算理与算法",
    "authority": "教育部",
    "documentNumber": "教材〔2022〕2号",
    "issuedAt": "2022-03-25",
    "sourceUrl": "https://www.gov.cn/zhengce/zhengceku/2022-04/21/content_5686535.htm",
    "sourceLocator": "《义务教育数学课程标准（2022年版）》第18页，第一学段内容要求，数与运算（4）",
    "status": "indexed-section"
  },
  {
    "id": "cn-math-2022:primary/number-algebra/stage-1/number-and-operations/content-5",
    "title": "第一学段：简单整数乘除法的算理与算法",
    "authority": "教育部",
    "documentNumber": "教材〔2022〕2号",
    "issuedAt": "2022-03-25",
    "sourceUrl": "https://www.gov.cn/zhengce/zhengceku/2022-04/21/content_5686535.htm",
    "sourceLocator": "《义务教育数学课程标准（2022年版）》第18页，第一学段内容要求，数与运算（5）",
    "status": "indexed-section"
  },
  {
    "id": "cn-math-2022:primary/number-algebra/stage-1/number-and-operations/content-6",
    "title": "第一学段：生活问题中的数与运算应用",
    "authority": "教育部",
    "documentNumber": "教材〔2022〕2号",
    "issuedAt": "2022-03-25",
    "sourceUrl": "https://www.gov.cn/zhengce/zhengceku/2022-04/21/content_5686535.htm",
    "sourceLocator": "《义务教育数学课程标准（2022年版）》第18页，第一学段内容要求，数与运算（6）",
    "status": "indexed-section"
  },
  {
    "id": "cn-math-2022:primary/number-algebra/stage-1/quantitative-relations/content-1",
    "title": "第一学段：生活情境中的数与运算解决问题",
    "authority": "教育部",
    "documentNumber": "教材〔2022〕2号",
    "issuedAt": "2022-03-25",
    "sourceUrl": "https://www.gov.cn/zhengce/zhengceku/2022-04/21/content_5686535.htm",
    "sourceLocator": "《义务教育数学课程标准（2022年版）》第19页，第一学段内容要求，数量关系（1）",
    "status": "indexed-section"
  },
  {
    "id": "cn-math-2022:primary/number-algebra/stage-1/quantitative-relations/content-2",
    "title": "第一学段：简单情境变化规律的数或符号表达",
    "authority": "教育部",
    "documentNumber": "教材〔2022〕2号",
    "issuedAt": "2022-03-25",
    "sourceUrl": "https://www.gov.cn/zhengce/zhengceku/2022-04/21/content_5686535.htm",
    "sourceLocator": "《义务教育数学课程标准（2022年版）》第19页，第一学段内容要求，数量关系（2）",
    "status": "indexed-section"
  },
  {
    "id": "cn-math-2022:primary/geometry/stage-1/shape-recognition-and-measurement",
    "title": "第一学段（1-2年级）：图形的认识与测量",
    "authority": "教育部",
    "documentNumber": "教材〔2022〕2号",
    "issuedAt": "2022-03-25",
    "sourceUrl": "https://www.gov.cn/zhengce/zhengceku/2022-04/21/content_5686535.htm",
    "sourceLocator": "《义务教育数学课程标准（2022年版）》第17页，表2",
    "status": "indexed-section"
  },
  {
    "id": "cn-math-2022:primary/geometry/stage-1/shape-recognition-and-measurement/content-1",
    "title": "第一学段：简单立体与平面图形的辨认、分类和拼组",
    "authority": "教育部",
    "documentNumber": "教材〔2022〕2号",
    "issuedAt": "2022-03-25",
    "sourceUrl": "https://www.gov.cn/zhengce/zhengceku/2022-04/21/content_5686535.htm",
    "sourceLocator": "《义务教育数学课程标准（2022年版）》第28页，第一学段内容要求，图形的认识与测量（1）",
    "status": "indexed-section"
  },
  {
    "id": "cn-math-2022:primary/geometry/stage-1/shape-recognition-and-measurement/content-2",
    "title": "第一学段：长度单位、估测与测量",
    "authority": "教育部",
    "documentNumber": "教材〔2022〕2号",
    "issuedAt": "2022-03-25",
    "sourceUrl": "https://www.gov.cn/zhengce/zhengceku/2022-04/21/content_5686535.htm",
    "sourceLocator": "《义务教育数学课程标准（2022年版）》第28页，第一学段内容要求，图形的认识与测量（2）",
    "status": "indexed-section"
  },
  {
    "id": "cn-math-2022:primary/geometry/stage-1/shape-recognition-and-measurement/content-3",
    "title": "第一学段：图形认识与测量中的空间观念和量感",
    "authority": "教育部",
    "documentNumber": "教材〔2022〕2号",
    "issuedAt": "2022-03-25",
    "sourceUrl": "https://www.gov.cn/zhengce/zhengceku/2022-04/21/content_5686535.htm",
    "sourceLocator": "《义务教育数学课程标准（2022年版）》第28页，第一学段内容要求，图形的认识与测量（3）",
    "status": "indexed-section"
  },
  {
    "id": "cn-math-2022:primary/statistics-probability/stage-1/data-classification",
    "title": "第一学段（1-2年级）：数据分类",
    "authority": "教育部",
    "documentNumber": "教材〔2022〕2号",
    "issuedAt": "2022-03-25",
    "sourceUrl": "https://www.gov.cn/zhengce/zhengceku/2022-04/21/content_5686535.htm",
    "sourceLocator": "《义务教育数学课程标准（2022年版）》第17页，表2",
    "status": "indexed-section"
  },
  {
    "id": "cn-math-2022:primary/statistics-probability/stage-1/data-classification/content-1",
    "title": "第一学段：按标准分类并描述分类过程",
    "authority": "教育部",
    "documentNumber": "教材〔2022〕2号",
    "issuedAt": "2022-03-25",
    "sourceUrl": "https://www.gov.cn/zhengce/zhengceku/2022-04/21/content_5686535.htm",
    "sourceLocator": "《义务教育数学课程标准（2022年版）》第37页，第一学段内容要求，数据分类（1）",
    "status": "indexed-section"
  },
  {
    "id": "cn-math-2022:primary/integrated-practice/stage-1/thematic-activities",
    "title": "第一学段（1-2年级）：综合与实践主题活动",
    "authority": "教育部",
    "documentNumber": "教材〔2022〕2号",
    "issuedAt": "2022-03-25",
    "sourceUrl": "https://www.gov.cn/zhengce/zhengceku/2022-04/21/content_5686535.htm",
    "sourceLocator": "《义务教育数学课程标准（2022年版）》第43页，第一学段内容要求",
    "status": "indexed-section"
  },
  {
    "id": "cn-math-2022:primary/integrated-practice/stage-1/thematic-activities/content-1",
    "title": "第一学段：联系生活的数学主题活动",
    "authority": "教育部",
    "documentNumber": "教材〔2022〕2号",
    "issuedAt": "2022-03-25",
    "sourceUrl": "https://www.gov.cn/zhengce/zhengceku/2022-04/21/content_5686535.htm",
    "sourceLocator": "《义务教育数学课程标准（2022年版）》第43-44页，第一学段内容要求",
    "status": "indexed-section"
  },
  {
    "id": "cn-math-2022:primary/number-algebra/stage-2/number-and-operations",
    "title": "第二学段（3-4年级）：数与运算",
    "authority": "教育部",
    "documentNumber": "教材〔2022〕2号",
    "issuedAt": "2022-03-25",
    "sourceUrl": "https://www.gov.cn/zhengce/zhengceku/2022-04/21/content_5686535.htm",
    "sourceLocator": "《义务教育数学课程标准（2022年版）》第16页，表2",
    "status": "indexed-section"
  },
  {
    "id": "cn-math-2022:primary/number-algebra/stage-2/number-and-operations/content-1",
    "title": "第二学段：万以内数与多位数乘除法",
    "authority": "教育部",
    "documentNumber": "教材〔2022〕2号",
    "issuedAt": "2022-03-25",
    "sourceUrl": "https://www.gov.cn/zhengce/zhengceku/2022-04/21/content_5686535.htm",
    "sourceLocator": "《义务教育数学课程标准（2022年版）》第20页，第二学段内容要求，数与运算（1）",
    "status": "indexed-section"
  },
  {
    "id": "cn-math-2022:primary/number-algebra/stage-2/number-and-operations/content-2",
    "title": "第二学段：初步认识分数和小数及其加减法",
    "authority": "教育部",
    "documentNumber": "教材〔2022〕2号",
    "issuedAt": "2022-03-25",
    "sourceUrl": "https://www.gov.cn/zhengce/zhengceku/2022-04/21/content_5686535.htm",
    "sourceLocator": "《义务教育数学课程标准（2022年版）》第21页，第二学段内容要求，数与运算（2）",
    "status": "indexed-section"
  },
  {
    "id": "cn-math-2022:primary/number-algebra/stage-2/number-and-operations/content-3",
    "title": "第二学段：整数四则混合运算",
    "authority": "教育部",
    "documentNumber": "教材〔2022〕2号",
    "issuedAt": "2022-03-25",
    "sourceUrl": "https://www.gov.cn/zhengce/zhengceku/2022-04/21/content_5686535.htm",
    "sourceLocator": "《义务教育数学课程标准（2022年版）》第21页，第二学段内容要求，数与运算（3）",
    "status": "indexed-section"
  },
  {